title,description,price,pagecount,publisher,writer,artist,coverartist,productcode,upc,color,format
Injustice Gods Among Us Year Three TP Vol 01,"(W) Tom Taylor (A) Mike S. Miller, Bruno Redondo (CA) Neil Googe The war is over, but it claimed a civilian victim whose death John Constantine will not let go unavenged. Joining forces with Batman, Constantine unites a team of magical beings, super heroes, and ordinary humans to finish off Superman. Collects issues #1-7 of the hit series!",8.69,160.0,DC,Tom Taylor,Mike S. Miller,Neil Googe,NOV150270,9781401263140,Full Color,Softcover
Injustice Gods Among Us Year Four Complete Coll TP,"(W) Brian Buccellato, Tom Taylor (A) Bruno Redondo, Others (CA) Yildiray Cinar When Superman and the Justice League declared themselves the ultimate authority on planet Earth, only Batman stood against them-but now Batman is defeated. His resistance army has suffered major losses and dwindled to nearly nothing. The man who always has a backup plan for his backup plans has nothing-except for one final, desperate gambit. Collects Injustice: Gods Among Us: Year Four #1-12 and Injustice: Gods Among Us: Year Four Annual #1!",17.39,,DC,Brian Buccellato,Bruno Redondo,Yildiray Cinar,OCT180590,9781401285807,Color,Softcover
Injustice Gods Among Us Year Five Complete Coll TP,"(W) Brian Buccellato (A) Iban Coello & Various (CA) Brett Booth, Norm Rapmund In the war between Superman and Batman, all the heroes have chosen sides. For five years, former friends and allies have fought bitterly, with casualties on both sides. Now, at an impasse, both Batman and Superman realize that to gain ground in their battle, they'll have to do the unthinkable: recruit their former enemies to attack their former friends. Collects Injustice: Gods Among Us: Year Five #1-20 and the Annual #1.",20.29,496.0,DC,Brian Buccellato,Iban Coello,Brett Booth,OCT190676,9781401295660,Color,Softcover
Injustice Gods Among Us Year Five TP Vol 01,"(W) Brian Buccellato (A) Mike S. Miller, Bruno Redondo (CA) David Yardin Having defeated the Green Lantern Corps, the forces of magic, and now the gods themselves, the Superman's regime seems to have eliminated all threats. Yet uneasy lies the crown on the head of the Man of Steel. Still obsessed with the outlaw Batman and worried about having enough troops to police his world, the Man of Steel begins to recruit some of Earth's deadliest villains to his side. Collects issues #1-7 of Year Five.",9.85,176.0,DC,Brian Buccellato,Mike S. Miller,David Yardin,NOV160333,9781401268831,Full Color,Softcover
Injustice Gods Among Us Year 2 TP Vol 01,"(W) Tom Taylor (A) Bruno Redondo & Various (CA) Jheremy Raapack The death of one of their own has divided Earth's protectors as hero turns against hero. As Superman's iron grip on the world tightens, at the edge of the galaxy another grave threat approaches. Collects INJUSTICE: GODS AMONG US YEAR TWO #1-6.",8.69,144.0,DC,Tom Taylor,Bruno Redondo,Jheremy Raapack,JAN150374,9781401253400,Full Color,Softcover
Injustice Gods Among Us TP Vol 02,"(W) Tom Taylor (A) Jheremy Raapack & Various From the ashes of Metropolis come Superman and the JLA's newest ally: Lex Luthor! Against all odds, he's not only survived but now embraces Superman's goals. Of course, Lex has his own ideas for how to create a better world. The Man of Steel trusts him, but can the rest of his allies be so sure? Collecting INJUSTICE: GODS AMONG US #7-12 and ANNUAL #1!",9.85,224.0,DC,Tom Taylor,Jheremy Raapack,Unknown,OCT140368,9781401250454,Full Color,Softcover
Injustice Gods Among Us TP Vol 01,"In these stories from issues #1-6, things in the DC Universe have changed after Superman is tricked into destroying the one thing he loves most. Now the heroes of our world must whether they are with Superman or against him.",8.69,192.0,DC,Tom Taylor,Mike S. Miller Jheremy Raapack,Unknown,MAR140265,9781401248437,Color,Softcover
I Paparazzi Sc                                              ,"Written by Pat McGreal; ART and cover by Stephen John Phillips and Steven Parke In stores November 6. Now in softcover! This hallucinatory, psychological thriller recounts one night in the life of 'Monster' McGowran, one of New York City's paparazzi. A night that takes a left turn into weirdness when he's beaten to a pulp by the bodyguards of an inscrutable young movie star. But when Monster plans his revenge, he accidentally uncovers something strange, horrifying and not meant to be discovered.",9.97,96.0,DC,Pat Mcgreal,Stephen John Phillips Steven Parke,Stephen John Phillips Steven Parke,STAR17136,76194123203400111,Color,Softcover
Joker Endgame TP,"(W) Scott Snyder & Various (A) Greg Capullo & Various (CA) Greg Capullo Gotham City is overrun by Jokerized victims, and The Joker himself is prowling the streets. Even as Batman confronts the Clown Prince of Crime, ordinary citizens and Arkham inmates must confront the mark The Joker has left on the city and themselves. Is anyone truly safe? This jam-packed collection features stories from BATMAN #35-40, BATMAN ANNUAL #3, GOTHAM ACADEMY: ENDGAME #1, BATGIRL: ENDGAME #1, DETECTIVE COMICS: ENDGAME #1 and ARKHAM MANOR: ENDGAME #1.",14.49,312.0,DC,Scott Snyder,Greg Capullo,Greg Capullo,FEB160224,9781401261658,Color,Softcover
Injustice 2 TP Vol 05,"(W) Tom Taylor (A) Xermanico & Various (CA) Tyler Kirkham Condemned to a prison planet by the Guardians of Oa, Hal Jordan must come to grips with his role in Superman's failed Regime. Haunted by visions of the past and berated by his guard, Soranik, the former Green Lantern takes out his anger on a new arrival. But an attack on the prison might soon spell disaster for the Green Lantern Corps. Collects issues #25-30!",9.85,144.0,DC,Tom Taylor,Xermanico,Tyler Kirkham,APR190550,9781401292263,Color,Softcover
Injustice 2 TP Vol 04,"(W) Tom Taylor (A) Daniel Sampere & Various (CA) Bruno Redondo Batman looks for allies in an unexpected place-the Phantom Zone-and what he finds may change the course of his war with Ra's al Ghul! The Dark Knight leads his team-including Harley Quinn, Catwoman, Plastic Man, Green Arrow and Black Canary-to Superman's abandoned Fortress of Solitude in hopes of freeing the Teen Titans from their years-long exile in the Phantom Zone. But the Fortress isn't abandoned, and more than just the Titans are about to escape the Phantom Zone! It's a rescue with unexpected casualties, and success will require the return of one hero near death and another one long vanished! Collects INJUSTICE 2 #18-24.",9.85,160.0,DC,Tom Taylor,Daniel Sampere,Bruno Redondo,JAN190678,9781401289157,Color,Softcover
Justice League By Scott Snyder Book Two Deluxe Edition HC,"(W) Scott Snyder, James Tynion IV (A) Various (CA) Jorge Jimenez Scott Snyder reunites the World?s Greatest Heroes for epic journeys to ?Hawkworld? and ?The Sixth Dimension? in the second deluxe edition hardcover of the superstar writer?s Justice League run!<p>Martian Manhunter, John Stewart, and Hawkgirl take a trip to Thanagar-Prime, as J?onn looks to tap into the ancient Martian mental database, Green Lantern struggles while practicing his new UV powers, and Kendra searches for answers about her connection to the Totality.<p>Then, the Justice League has the map to the Sixth Dimension in hand?the key to saving the Multiverse from utter destruction! But with Superman trapped on a world with no light and hundreds of dead Supermen, Lex Luthor?s Legion of Doom is poised for victory. The final form of Perpetua takes shape, and the DCU will never be the same again!<p>Collects Justice League #14-25 and Annual #1.",23.19,,DC,James Tynion Iv Scott Snyder,Various,Jorge Jimenez,AUG207139,9781779505842,Full Color,Hardcover
House of Whispers Vol 03 Watching the Watchers TP (MR),"(W) NALO HOPKINSON and DAN WATTERS (A) DOMINIKE ?DOMO? STANTON and MATTHEW DOW SMITH (CA) DAVID MACK The goddess Erzulie is grieving the loss of one of her husbands, while her remaining spouses are asking themselves if they can remain by her side. But in the darkness, the Corinthian has his eyes on Erzulie?s place. Erzulie will need allies?including Papa Midnite, the dangerous immortal on whom everyone in the afterlife has sworn revenge! Collects House of Whispers #13-22.",11.59,,DC,Nalo Hopkinson And Dan Watters,Dominike ?Domo? Stanton And Matthew Dow Smith,David Mack,JUL207123,9781779504319,Full Color,Softcover
I Paparazzi HC (MR)                               ,"This hallucinatory, psychological thriller recounts one night in the life of ""Monster"" McGowran, one of New York City's paparazzi. A night that takes a left turn into weirdness when he's beaten to a pulp by the bodyguards of an inscrutable young movie star. But when Monster plans his revenge, he accidentally uncovers something strange, horrifying and not meant to be discovered.",17.37,96.0,DC,Pat Mcgreal,Steven Parke Stephen John Phillips,Steven Parke Stephen John Phillips,STAR14245,761941227801,Color,Hardcover
Justice League Dark TP Vol 06 Lost In Forever,"(W) J. M. DeMatteis (A) Andres Guinaldo & Various (CA) Guillem March In these stories from issues #35-40 and ANNUAL #2, Zatanna assumes leadership of the team and prepares to rebuild. With team members angry and confused by John Constantine's methods during their recent battles, how will Constantine fit into this new team, if at all?",9.85,200.0,DC,J. M. Dematteis,Andres Guinaldo,Guillem March,MAY150242,9781401254810,Full Color,Softcover
Jsa By Geoff Johns Book Four TP,"(W) GEOFF JOHNS and DAVID GOYER (A) LEONARD KIRK, STEPHEN SADOWSKI, PATRICK GLEASON, KEITH GIFFEN, PETER SNEJBJERG, and others (CA) MICHAEL BAIR Geoff Johns?s epic JSA run continues as heroes from around the world are vanishing, the JSA is divided, and the team is vulnerable to the threat of Vandal Savage! In the Ultra-Humanite?s latest world-conquering scheme, heroes from around the world?including members of the JSA?are vanishing, and those who remain must forge an unusual alliance with the Icicle to save the day. And with the JSA divided, handling multiple matters in different eras, several heroes find themselves in ancient Egypt, fighting the immortal villain Vandal Savage and an earlier incarnation of the powerful Black Adam. However, Power Girl and Dr. Mid-Nite also have their hands full with separate cases. Collects JSA #32-45.",23.19,,DC,Geoff Johns And David Goyer,"Stephen Sadowski, Patrick Gleason, Keith Giffen, Peter Snejbjerg, And Others Leonard Kirk",Michael Bair,JUL207124,9781779505613,Full Color,Softcover
Joker War Saga HC,"(W) Various (A) Various (CA) Ben Oliver The summer 2020 blockbuster ?The Joker War? is collected in this new hardcover that includes the tie-in chapters starring Batgirl, Red Hood, Nightwing, Catwoman, and, of course, Harley Quinn! As the Clown Prince of Crime battles the Dark Knight Detective head-to-head one last time. The Joker has never wanted to win before?he?s never wanted his battle with Batman to end. But now his motivation has shifted. This collection features the Joker?s confrontation with Batgirl; his manipulation of the amnesiac Nightwing; and a turf war between Gotham City?s many evildoers! Plus, the debut of Clownhunter, a cameo by Ghost-Maker, and an epic battle between Harley Quinn and Punchline! Collects Batman #95-100, Batgirl #47, Detective Comics #1025, Red Hood: Outlaw #48, Nightwing #74, The Joker War Zone #1, plus stories from Harley Quinn #75 and Catwoman #25.",23.19,,DC,Various,Various,Ben Oliver,NOV207081,9781779511799,Full Color,Hardcover
Huntress Origins TP,"(W) Paul Levitz (A) Joe Staton & Various (CA) Brian Bolland These are the 1970s stories that first introduced the Huntress: daughter of Batman and Catwoman of Earth-2! But after her mother is murdered, Helena dons a costume of her own. With her crossbow as her weapon, the Huntress vows to avenge her mother's death. This title collects stories from DC Super Stars #17, Batman Family #18-20, and Wonder Woman #271-287, #289, #290, #294, and #295.",11.59,224.0,DC,Paul Levitz,Joe Staton,Brian Bolland,OCT190672,9781779500724,Color,Softcover
Joker TP Black Label,"(W) Brian Azzarello (A) Lee Bermejo, Mick Gray (CA) Lee Bermejo FIRST TIME IN PAPERBACK! From writer Brian Azzarello and artist Lee Bermejo, the team behind the best-selling BATMAN: DAMNED, JOKER tells the story of one very dark night in Gotham City-a harrowing night of revenge, murder and crime as only The Joker can deliver it, as he brutally takes back his stolen assets from the Penguin, the Riddler, Two-Face, Killer Croc and others.",8.69,144.0,DC,Brian Azzarello,Lee Bermejo,Lee Bermejo,APR190556,9781401291860,Color,Softcover
Justice League By Geoff Johns Box Set Vol 01,"(W) Geoff Johns (A) Jim Lee & Various The first three collections of Geoff John's stellar run on JUSTICE LEAGUE are collected in a slipcase trade paperback! Don't miss the fast-paced action from the pages of JUSTICE LEAGUE VOL. 1: ORIGIN, JUSTICE LEAGUE VOL. 2: THE VILLAIN'S JOURNEY and JUSTICE LEAGUE VOL. 3: THRONE OF ATLANTIS, collecting JUSTICE LEAGUE #1-17 and AQUAMAN #15-16.",28.99,500.0,DC,Geoff Johns,Jim Lee,Unknown,APR170429,9781401276126,Color,Softcover
Just Imagine Stan Lee Creating the DC Universe Book 02 TP New Edition,"(W) Stan Lee, Michael Uslan (A) Various (CA) Adam Hughes In 2001, the unthinkable happened?Stan Lee, the comics creator most synonymous with Marvel, reimagined DC?s greatest heroes with a lineup of comics? greatest artists. Back in print following the legend?s passing in 2018, this collects the second half of Lee?s unique takes on DC?s greatest icons, reinventing them from the ground up.<p>Collects Just Imagine Stan Lee with John Byrne Creating Robin #1, Just Imagine Stan Lee with Gary Frank Creating SHAZAM! #1, Just Imagine Stan Lee with Scott McDaniel Creating Aquaman #1, Just Imagine Stan Lee with Chris Bachalo Creating Catwoman #1, Just Imagine Stan Lee with Walter Simonson Creating the Sandman #1, and Just Imagine Stan Lee with John Cassaday Creating Crisis #1.",20.29,,DC,Michael Uslan Stan Lee,Various,Adam Hughes,OCT207142,9781779506009,Full Color,Softcover
Joker Killer Smile HC,"The Eisner-nominated creative team of writer Jeff Lemire and artist Andrea Sorrentino (Green Arrow, Gideon Falls) reunite for a psychological horror story that delves into the bottomless insanity of The Joker. Everyone knows The Joker doesn't have the most promising history with psychotherapists. In fact, no one's even been able to diagnose him. But that doesn't matter to Dr. Ben Arnell; he's determined to be the one to unravel this unknowable mind. And there's no way The Joker could ever get through the therapeutic walls Ben has built around himself. Right? There's no way The Joker's been entering his house at night...right? There's no way The Joker has stood over his son's bed and put that book in his hands, the one with the, the, the... Collects Joker: Killer Smile #1-3 and Batman: The Smile Killer #1.",17.39,144.0,DC,Unknown,Unknown,Unknown,APR200679,9781779502698,Full Color,Hardcover
Justice League TP Vol 03 Throne of Atlantis (N52),"In this sea-splashed epic from JUSTICE LEAGUE #13-17 and AQUAMAN #15-16, Ocean Master leads the undersea forces in an attack on the United States! The Justice League must turn back the tide, but how can they save the world from annihilation?",9.85,192.0,DC,Geoff Johns,Various Ivan Reis,Joe Prado Ivan Reis,JAN140339,9781401246983,Color,Softcover
Justice League TP Vol 02 the Villains Journey (N52),"In this new trade paperback collecting issues #7-12 of the smash-hit series, find out what who has joined the team after its origin! And why does Green Arrow want to join their ranks so badly? Plus, someone is out to get the Justice League, and he is determined to show the world how mortal these godlike beings really are!",9.85,176.0,DC,Geoff Johns,Various Jim Lee,Jim Lee Scott Williams,JUN130261,9781401237653,Color,Softcover
Justice League TP Vol 02 Outbreak (Rebirth),"(W) Bryan Hitch (A) Matthew Clark & Various (CA) Tony S. Daniel, Sandu Florea After the team's Green Lanterns use their mastery over fear to help the rest of the Justice League, they must face an even greater threat: An unknown villain who's hacking into the Justice League's computers, causing the Batcave's weapons and security systems to turn against the Dark Knight and the Watchtower satellite to plummet to Earth - with Cyborg trapped on board! Collects JUSTICE LEAGUE #6-11.",9.85,152.0,DC,Bryan Hitch,Matthew Clark,Tony S. Daniel,JAN170380,9781401268701,Full Color,Softcover
Justice League TP Vol 01 the Totality TP,"(W) Scott Snyder, James TynionIV (A) Jim Cheung & Various (CA) Jim Cheung Spinning out of the cataclysmic events of Dark Nights: Metal and JUSTICE LEAGUE: NO JUSTICE, the core members of the Justice League-Superman, Batman, Wonder Woman, Aquaman, the Flash and more-are reunited in all-new adventures! The League was forced to make an impossible decision...and now it's time to face the consequences! The returning Martian Manhunter struggles to protect the team from an incoming threat that will shatter the world as they know it, while a familiar face strikes out on a dark path...This new title collects JUSTICE LEAGUE #1-7!",10.43,,DC,Scott Snyder,Jim Cheung,Jim Cheung,AUG180630,9781401284992,Color,Softcover
Justice League TP Vol 03 Hawkworld,"(W) Scott Snyder, James TynionIV (A) Jim Cheung & Various (CA) Jim Cheung It's a mystery in space: Why would the Guardians of the Universe hide top-secret intel deep in the bowels of a secret vault on Thanagar Prime? The answers will change the DC Universe forever! Martian Manhunter, John Stewart and Hawkgirl avoided 'Drowned Earth' with a detour to Thanagar-Prime: J'onn looks to tap into the ancient Martian mental database, Green Lantern struggles while practicing his new UV powers, and Kendra searches for answers about her connection to the Totality. Collects JUSTICE LEAGUE #13-18 and ANNUAL #1.",10.43,184.0,DC,Scott Snyder,Jim Cheung,Jim Cheung,APR190555,9781401291389,Color,Softcover
Justice League TP Vol 01 Origin (N52),"Now in trade paperback from comics superstars Geoff Johns and Jim Lee! In a universe where Super Heroes are strange and new, Batman has discovered a dark evil that requires him to unite the World Greatest Heroes! Superman, Batman, Wonder Woman, Green Lantern, Aquaman, The Flash and Cyborg unite for the first time to form the JUSTICE LEAGUE! Don't miss the thrill-a-minute collection of the first six issues of the best-selling comic!",9.85,192.0,DC,Geoff Johns,Scott Williams Jim Lee,Scott Williams Jim Lee,OCT120252,9781401237882,Color,Softcover
Justice League TP Vol 01 the Extinction Machine (Rebirth),"(W) Bryan Hitch (A) Tony S. Daniel & Various (CA) Tony S. Daniel In these stories from JUSTICE LEAGUE: REBIRTH #1 and issues #1-5 of the new series, a new day dawns for the Justice League as they welcome a slew of new members into their ranks. The question remains though, can the world's greatest superheroes trust these new recruits? And will the members of the League be able to come together against an ancient evil that threatens to reclaim not just the world, but the entire universe?",9.85,168.0,DC,Bryan Hitch,Tony S. Daniel,Tony S. Daniel,OCT160295,9781401267797,Full Color,Softcover
Justice League Their Greatest Triumphs TP,"(W) Geoff Johns & Various (A) Jim Lee & Various (CA) Jim Lee, Scott Williams With Warner Bros. movie JUSTICE LEAGUE set to hit theaters in November, DC offers this new collection of adventures starring the World's Greatest Heroes by some of comics' most legendary talent, including Geoff Johns, Jim Lee and more!",5.79,168.0,DC,Geoff Johns,Jim Lee,Jim Lee,JUL170482,9781401273514,Color,Softcover
Justice League the Darkseid War Essential Edition TP,"The Justice League originally united to stop the forces of Darkseid from destroying Earth! Now the ruler of Apokolips is back in this new DC Essential collection, but this time he's set his sights on the world-shattering Anti-Monitor. Will the combined might of the Justice League be enough to protect Earth from becoming collateral damage as gods fight? This title collects JUSTICE LEAGUE #40-50, a story from DC COMICS DIVERGENCE #1 and JUSTICE LEAGUE: DARKSEID SPECIAL #1.",17.39,,DC,Unknown,Unknown,Unknown,JUL180763,9781401284558,Color,Softcover
Justice League Suicide Squad #1 (Of 6) DCBS Var Ed *Fedex Upgrade,The first major event storyline of DC's Rebirth era begins with a day Amanda Waller always knew would come: the Justice League discovers the existence of the Suicide Squad! This government-sponsored black-ops team of super-villains with bombs implanted in their brains is obviously a deal-breaker for Earth's paragons of truth and justice! But you can bet that the Wall and her Task Force X won't go down without the fight to end all fights as this weekly series gets underway!,3.99,40.0,DC,Joshua Williamson,Jason Fabok,Jason Fabok,OCT168751,76194134865000126,Color,Softcover
Justice League Power Rangers TP,"(W) Tom Taylor (A) Stephen Byrne (CA) Karl Kerschl Something terrible has happened in Angel Grove! When the Command Center is breached and the teleporters are damaged, Zack is flung into another universe, where he's mistaken for a villain by a mysterious masked vigilante. Can the other Power Rangers get to their friend in time to save him from Batman? Collects Justice League/Power Rangers #1-6. Co-published with BOOM! Studios.",9.85,,DC,Tom Taylor,Stephen Byrne,Karl Kerschl,AUG180629,9781401285159,Color,Softcover
Justice League of America Midsummers Nightmare DLX HC,"(W) Mark Waid, Fabian Nicieza (A) Jeff Johnson, Darick Robertson (CA) Kevin Maguire In this three-issue miniseries that led into Grant Morrison's JLA run, something is wrong with the World's Greatest Heroes! Each has forgotten the life in which he or she wore a costume and protected the planet with their own unique powers and abilities. Even stranger, ordinary people everywhere are gaining their own powers in an insidious plan to cultivate Earth's population as a race of super-soldiers!",14.49,128.0,DC,Mark Waid,Jeff Johnson,Kevin Maguire,JUL170480,9781401274320,Color,Hardcover
Justice League of America the Road to Rebirth TP,"(W) Steve Orlando, Jody Houser (A) Ivan Reis & Various (CA) Ivan Reis, Joe Prado Spinning out of JUSTICE LEAGUE VS. SUICIDE SQUAD, as a part of DC Universe Rebirth, the most diverse Justice League of America ever returns! Explore the roots of four very different metahumans in stories from Justice League Of America: Rebirth #1, Justice League Of America: Killer Frost #1, Justice League Of America: The Ray #1, Justice League Of America: The Atom #1 and Justice League Of America: Vixen #1",8.69,128.0,DC,Steve Orlando,Ivan Reis,Ivan Reis,MAR170413,9781401273521,Full Color,Softcover
Justice League of America By Brad Meltzer DLX Ed HC,"(W) Geoff Johns, Brad Meltzer (A) Ed Benes & Various (CA) Ed Benes New York Times bestselling novelist Brad Meltzer's entire run on Justice League of America is collected for the first time! After the darkest hour in the history of the DC Universe, Superman, Batman, and Wonder Woman meet to choose who will make up the new Justice League of America. Then, the new team discovers that several members of the Legion of Super-Heroes are in the present! With the help of the Justice Society of America, Superman and his team must track down all seven Legionnaires to discover why these heroes have traveled back in time! Collects Justice League of America (2006) #0-12 and Justice Society of America (2006) #5-6.",23.19,470.0,DC,Unknown,Unknown,Unknown,MAR200652,9781779502452,Full Color,Hardcover
Justice League of America Archives HC Vol 02,"These deluxe hardcover editions reprint the Justice League of America's earliest adventures, including the rare Brave & the Bold issues and early Justice League of America tales. These classic tales feature a stellar line-up, with a roster including Wonder Woman, Superman, Batman, and more!",24.97,256.0,DC,Gardner Fox,Mike Sekowsky Murphy Anderson,Mike Sekowsky Murphy Anderson,STAR12082,76194120116000212,Color,Hardcover
Justice League Rebirth DLX Coll HC Book 01,"(W) Bryan Hitch (A) Tony S. Daniel & Various (CA) Tony S. Daniel A new day dawns for the Justice League as they welcome a slew of new members into their ranks. But can the world's greatest superheroes trust these new recruits? And will the members of the League be able to come together against an ancient evil that threatens to reclaim not just the world, but the entire universe?! Collects JUSTICE LEAGUE: REBIRTH #1 and JUSTICE LEAGUE #1-11.",20.29,312.0,DC,Bryan Hitch,Tony S. Daniel,Tony S. Daniel,APR170416,9781401271138,Color,Hardcover
Justice League Power Rangers HC,"(W) Tom Taylor (A) Stephen Byrne (CA) Karl Kerschl Something terrible has happened in Angel Grove! When the Command Center is breached and the teleporters are damaged, Zack is flung into another universe, where he's mistaken for a villain by a mysterious masked vigilante. Can the other Power Rangers get to their friend in time to save him from Batman? Collects Justice League/Power Rangers #1-6. Co-published with BOOM! Studios.",14.49,160.0,DC,Tom Taylor,Stephen Byrne,Karl Kerschl,SEP170418,9781401272005,Color,Hardcover
Justice League of America A Celebration of 60 Years HC (Limit 1 Per Customer),"(W) Gardner Fox & Various (A) Mike Sekowsky & Various (CA) Jim Cheung Celebrate the 60-year history of the Justice League! This volume includes pivotal moments such as 'Crisis on Earth-Three,' the formation of Justice League International, the debut of the 1990s JLA series, the team's New 52 origin, and more! Collects The Brave and the Bold #28; Justice League of America #29-30, #79, #140, #144 and #200 (1964-1982); Justice League of America Annual #2; Justice League #1 (1987); JLA #1 and #43; Justice League of America #1 (2006); Justice League #1 (2011); and Justice League #1 (2018).",17.39,448.0,DC,Unknown,Unknown,Unknown,DEC190574,9781401299514,Color,Hardcover
