title,description,price,pagecount,publisher,writer,artist,coverartist,productcode,upc,color,format
Superman Chronicles Vol 1 TP,"Presenting an exciting new way to experience the rich history of the Man of Steel in an affordable trade paperback collection of every Superman adventure, in color, in chronological order! SUPERMAN CHRONICLES VOL. 1 reprints the earliest stories of the world's first super-hero, originally published in ACTION COMICS #1-13, NEW YORK WORLD'S FAIR #1 and SUPERMAN #1 (1938-1939)! These historic tales feature the first adventures of the Man of Steel by Superman creators Jerry Siegel and Joe Shuster. Future volumes in this series will reprint stories from ACTION, SUPERMAN, WORLD'S FINEST and other titles throughout the character's history, all presented chronologically based on publication date!",10.43,208.0,DC,Jerry Siegel,Joe Shuster,Joe Shuster,OCT138013,1401207642,Color,Softcover
Superman Batman TP Vol 01,"In this new edition from issues #1-13 of the hit series, Superman and Batman unite when Lex Luthor assembles a team of powerhouse heroes to bring Superman in dead or alive. Then, prepare for the arrival of Supergirl! Can Darkseid recruit her into doing his bidding?",11.59,336.0,DC,Jeph Loeb,Various Ed Mcguinness,Dexter Vines Ed Mcguinness,JAN140354,9781401248185,Color,Softcover
Superman Batman Omnibus HC Vol 01,"(W) Jeph Loeb & Various (A) Ed McGuinness & Various (CA) Dexter Vines, Ed McGuinness The fan-favorite series is collected in omnibus format! The Man of Steel and the Dark Knight unite when President Lex Luthor accuses Superman of a crime against humanity, and assembles a team of powerhouse heroes to bring Superman in-dead or alive. Plus, prepare for the arrival of Supergirl! Batman has discovered something strange at the bottom of Gotham Bay, which leads him to a mysterious and powerful teenage girl bent on destroying Gotham City! Collects issues #1-43, plus Superman/Batman Secret Files #1, and Annual #1 and #2.",72.5,1208.0,DC,Jeph Loeb,Ed Mcguinness,Dexter Vines,SEP190601,9781779500298,Full Color,Hardcover
Superman Archives Vol 7 HC,"The Golden Age of Superman hits its stride in SUPERMAN ARCHIVES VOL. 7, reprinting SUPERMAN #25-29 (1943-1944)! With World War II heating up, Superman fights subversion and sabotage at home while foiling villains like the Toyman and the Prankster.",28.99,240.0,DC,"Jerry Siegel, Bill Finger And Others Don Cameron","Fred Ray, George Roussos And Others Joe Shuster",Fred Ray,JAN060296,1401210511,Color,Hardcover
Superman Archives Vol 2 HC New Ptg,The reprinting of the Man of Steel's Golden Age Adventures continues with this hardcover collection of Superman #5-8.,24.99,272.0,DC,Jerry Siegel,Joe Shuster,Joe Shuster,MAR058086,9780930289768,Color,Hardcover
Titans Burning Rage TP,"(W) Dan Jurgens (A) Scott Eaton, Wayne Faucher Paranoia rules the streets while crime-fighting couple Hawk and Dove lead ordinary citizens in an uprising against the rich?but former Doom Patrol member Mento is pulling their strings! It?s up to the Titans to try to uncover his sinister purpose and keep peace before someone gets killed!<p>Collects Titans: Burning Rage #1-7.",9.85,,DC,Dan Jurgens,Wayne Faucher Scott Eaton,Unknown,OCT207162,9781779502995,Full Color,Softcover
Titans TP Vol 01 the Return of Wally West (Rebirth),"(W) Dan Abnett (A/CA) Brett Booth, Norm Rapmund Spinning out of the events of DC UNIVERSE: REBIRTH #1, this new band of Titans are on a quest to find out the truth behind the earth-shattering, universe-changing revelations that Wally ushered in in his return to the world he thought he'd lost. Wally, Donna, Arsenal, Garth, Lilith and Nightwing are on the hunt for the mysterious force that erased their memories, forcing them to forget what they could accomplish together. Reunited with their memories returned, the Titans must face the fearsome, forgotten foe who wiped Wally West from existence! Collects TITANS #1-6 and TITANS: REBIRTH #1.",9.85,168.0,DC,Dan Abnett,Brett Booth,Brett Booth,DEC160376,9781401268176,Full Color,Softcover
Titans the Lazarus Contract HC,"When Deathstroke discovers that Wally West's return holds the key to bringing his son back from the dead, he'll stop at nothing to do just that. Standing in his way? Both the Teen Titans and the Titans! But will the Titans and the Teen Titans be fast enough to stop him from changing the world as we know it? Collects TITANS #11, TEEN TITANS #8, DEATHSTROKE #19-20 and TEEN TITANS: THE LAZARUS CONTRACT SPECIAL #1.",14.49,136.0,DC,Unknown,Unknown,Unknown,AUG170327,9781401276508,Color,Hardcover
Superboy A Celebration of 75 Years HC,"This title celebrates Superboy across the decades, from young Clark Kent in Smallville, to Superboy's 1970s adventures with the Legion of Super-Heroes, to Conner Kent's 1990s escapades, and today's Jon Kent. This title collects stories from More Fun Comics #101, Superboy (1949) #10 and 89, Adventure Comics #210, 247, 271, 369, and 370, Superboy and the Legion of Super-Heroes #233 and 259, DC Comics Presents #87, Infinite Crisis #6, Adventures of Superman #501, Superboy (1994) #59, Teen Titans #24, Adventure Comics #2, Young Justice #3, and Superman (2016) #6, 10, and 11.",23.19,440.0,DC,Unknown,Unknown,Unknown,APR200688,9781779503152,Full Color,Hardcover
Tor HC Vol 03,"The final volume collecting Joe Kubert's classic series! This oversized archive-quality volume collects the remaining Tor material produced for DC and Marvel, as well as Kubert's self-published Sojourn. This volume also features an introduction by Roy Thomas and an 8-page sketchbook section. For more information, see the feature article.",24.97,168.0,DC,Joe Kubert,Joe Kubert,Joe Kubert,STAR19669,761941229119,Color,Hardcover
Teen Titans Vol 4 Robin No More TP,"(W) Adam Glass - Robbie Thompson (A) Eduardo Pansica - Julio Ferreira - Javier Fernandez (CA) Bernard Chang As this collection begins, Djinn is trapped in her ring with no escape while the Teen Titans go hunting for her older brother Elias, the only one capable of saving her. But Elias?s dark side is the stuff of legends...and the Teen Titans know he can?t be trusted. Then, with Robin gone and Mercy Hall shut down, can there still be a Teen Titans? And while Damian hunts the KGBeast, the team is on his trail?and they?re determined to find him before Batman does! Collects Teen Titans #39-47 and Teen Titans Annual #2. This title was previously solicited as Teen Titans Vol. 4: Djinn Wars.",11.59,,DC,Adam Glass - Robbie Thompson,Eduardo Pansica - Julio Ferreira - Javier Fernandez,Bernard Chang,NOV207093,9781779506689,Full Color,Softcover
Terrifics TP Vol 03 the God Game,"(W) Gene Luen Yang & Various (A) Stephen Segovia & Various (CA) Evan Shaner Simon Stagg strikes at the team with virtual dangers inspired by the twelve plagues of Egypt! Plus, it's Terrific tales times three as Plastic Man, Sapphire and Java each get their turn in the spotlight. Collects from The Terrifics #15-18 and Annual #1. Simon Stagg strikes at the team with virtual dangers inspired by the twelve plagues of Egypt! Plus, it's Terrific tales times three as Plastic Man, Sapphire and Java each get their turn in the spotlight. Collects from The Terrifics #15-18 and Annual #1.",9.85,144.0,DC,Unknown,Unknown,Unknown,FEB200580,9781779506078,Full Color,Softcover
Terrifics Vol 04 the Tomorrow War TP,"(W) Gene Luen Yang (A) Various (CA) Dan Mora Eisner Award-winning writer Gene Luen Yang brings the tales of the Terrifics to a time-twisting climax in this collection! Bizarro, frustrated with technological progress that never seems to end, has decided that he has had enough. And with the help of a time machine gifted to him by Lex Luthor, he decides to make the world a better place, Bizarro style. Will the Terrifics be caught in Bizarro?s distorted reality? Or will they be able to navigate the future...and past...to stop him? Includes a special ?choose your own destiny? adventure!<p>Collects The Terrifics #19-30.",14.49,,DC,Gene Luen Yang,Various,Dan Mora,SEP207108,9781779506085,Full Color,Softcover
Teen Titans Vol 3 Beast Boys and Girls TP,"Written by Geoff Johns and Ben Raab Art by Justiniano & Chris Ivy, Tom Grummett & Lary Stucker Cover by Ed McGuinness & Dexter Vines Explore the origins of Gar Logan in an action-packed new collection featuring the 3-issue BEAST BOY miniseries as well as the explosive 3-part story 'Wild Kingdom' presented in TEEN TITANS #13-15! This volume features an introduction by writer Geoff Johns!",5.79,,DC,Unknown,Unknown,Unknown,MAR050416,9781401204594,Unknown,Softcover
Teen Titans TP Vol 02 Turn It Up,"In these tales from issues #25-27 and ANNUAL #1, the team faces off against the Dark Knight's top security when they break into the Batcave. But what could be important enough to make Damian risk betraying Batman's trust? One betrayal leads to another, and Damian vows to hunt down Jason Todd. During the intense battle of the Robins, dangerous information falls into the wrong hands. Secrets are revealed as Djinn and Roundhouse open up about their mysterious pasts.",9.85,144.0,DC,Adam Glass,Bernard Chang,Giuseppe Camuncoli,JUL190660,9781401294670,Color,Softcover
Titans TP Vol 03 A Judas Among Us Rebirth,"(W) Dan Abnett (A) Kenneth Rocafort & Various (CA) Kenneth Rocafort As Omen begins her investigation into the identity of the team's traitor, the Titans launch a full assault on H.I.V.E., whom they believe hold the key to restoring Bumblebee's broken mind. Meanwhile, tensions rise when Roy discovers Wally and Donna's blossoming romance-which threatens to tear the Titans apart! Collects issues #12-18.",9.85,168.0,DC,Dan Abnett,Kenneth Rocafort,Kenneth Rocafort,NOV170356,9781401277598,Color,Softcover
Teen Titans TP Vol 05 the Trial of Kid Flash (N52),"(W) Scott Lobdell (A) Angel Unzueta & Various (CA) Brett Booth As seen in FOREVER EVIL, the Teen Titans have taken a fall through time itself! Along the way, they learn the secrets of Bart Allen's past - but can they stop his evil future self? Find out in these stories from issues #24-30 and ANNUAL #2.",10.43,256.0,DC,Scott Lobdell,Angel Unzueta,Brett Booth,NOV140302,9781401250539,Full Color,Softcover
Teen Titans TP Vol 03 Seek and Destroy,"(W) Adam Glass (A) Bernard Chang, Sean Chen (CA) Francis Manapul Lobo, intergalactic bounty hunter, is back for some quality time with his daughter Crush. But she and the Teen Titans are not having it. In the wake of ""The Terminus Agenda,"" the Teen Titans are still trying to figure out what their future looks like. But when Lobo shows up for Crush, they'll have to stand together against an enemy more sadistic than any they've faced before. Things go from bad to worse once Lobo accepts his ""Dark Gift"" from Lex Luthor, pitting both father and daughter against the Titans! Collects Teen Titans #31-38. Lobo, intergalactic bounty hunter, is back for some quality time with his daughter Crush. But she and the Teen Titans are not having it. In the wake of 'The Terminus Agenda,' the Teen Titans are still trying to figure out what their future looks like. But when Lobo shows up for Crush, they'll have to stand together against an enemy more sadistic than any they've faced before. Things go from bad to worse once Lobo accepts his 'Dark Gift' from Lex Luthor, pitting both father and daughter ag",11.59,192.0,DC,Unknown,Unknown,Unknown,JAN200668,9781779500083,Fc,Softcover
Teen Titans TP Vol 02 the Culling (N52),"In these tales from TEEN TITANS #8-14 and DC UNIVERSE PRESENTS #12, the organization called N.O.W.H.E.R.E. captures Superboy, the Teen Titans and Legion Lost and pits the young heroes against each other to weed out the weak! It will take everything these heroes have to save themselves-but the ruthless Harvest won't give up easily!",9.85,192.0,DC,Fabian Nicieza Scott Lobdell,Various Brett Booth,Norm Rapmund Brett Booth,MAR130272,9781401241032,Color,Softcover
Teen Titans TP Vol 01 Its Our Right to Fight,"SCOTT LOBDELL and BRETT BOOTH usher in a new era for the TEEN TITANS! Meet a new TITANS team, including new members SKITTER and BUNKER! Collecting TEEN TITANS #1-7!",8.69,168.0,DC,Scott Lobdell,Brett Booth Norm Rapmund,Brett Booth,JUN120239,9781401236984,Color,Softcover
Teen Titans TP Vol 01 Damian Knows Best (Rebirth),"(W) Ben Percy (A) Khoi Pham & Various (CA) Jonboy Meyers The Teen Titans are further apart than ever before...until Damian Wayne recruits Starfire, Raven, Beast Boy and the new Kid Flash to join him in a fight against his own grandfather, Ra's al Ghul! Collects issues #1-5 and TEEN TITANS: REBIRTH #1.",9.85,152.0,DC,Ben Percy,Khoi Pham,Jonboy Meyers,MAR170410,9781401270773,Color,Softcover
Teen Titans Raven TP DC Ink,"(W) Kami Garcia (A/CA) Gabriel Picolo When a tragic accident takes the life of seventeen-year-old Raven Roth's foster mom-and Raven's memory-she moves to New Orleans to live with her foster mother's family and finish her senior year of high school. Starting over isn't easy. Raven remembers how to solve math equations and make pasta, but she can't remember her favorite song or who she was before the accident. When strange things start happening-things most people would consider impossible-Raven starts to think it might be better not to know who she was in her previous life. But as she grows closer to her foster sister, Max, her new friends, and Tommy Torres, a guy who accepts her for who she is now, Raven has to decide if she's ready to face what's buried in the past...and the darkness building inside her. From the #1 New York Times best-selling co-author of Beautiful Creatures Kami Garcia and artist Gabriel Picolo comes this first graphic novel in the Teen Titans series for DC Ink, Teen Titans: Raven.",9.85,176.0,DC,Kami Garcia,Gabriel Picolo,Gabriel Picolo,FEB190469,9781401286231,Color,Softcover
Teen Titans Raven HC,"(W) Kami Garcia (A/CA) Gabriel Picolo Now in hardcover, this New York Times bestselling book makes the perfect addition to any library and the perfect gift for fans! When a tragic accident takes the life of 17-year-old Raven Roth?s foster mom?and Raven?s memory?she moves to New Orleans to recover and finish her senior year of high school. Starting over isn?t easy. Raven remembers everyday stuff like how to solve math equations and make pasta, but she can?t remember her favorite song or who she was before the accident. And when impossible things start happening, Raven begins to think it might even be better not to know who she was before. But as she grows closer to her new friends her foster sister, Max, and Tommy Torres; a guy who accepts her for who she is now, Raven has to decide if she?s ready to face what?s buried in the past...and the darkness building inside her. From #1 New York Times bestselling author Kami Garcia and fan-favorite artist Gabriel Picolo comes this riveting tale of finding the strength to face who you are and learning to trust others?and yourself.",11.59,,DC,Kami Garcia,Gabriel Picolo,Gabriel Picolo,JAN217054,9781779507273,Full Color,Hardcover
Teen Titans TP Vol 01 Full Throttle,"(W) Adam Glass (A) Bernard Chang, Robson Rocha (CA) Karmome Shirahama Tag along with the Teen Titans as they discover a new beginning without the supervision of their elders. Introducing brand-new characters like Crush, Lobo's illegitimate daughter; Roundhouse, a shape-shifting superhero noob, and Djinn, an 8,000-year-old genie who's just been let out of her bottle. With a new team behind him, Robin is building something in secret beneath the new Teen Titans HQ. Don't miss these tales from TEEN TITANS #20-24 and TEEN TITANS SPECIAL #1.",9.85,168.0,DC,Adam Glass,Bernard Chang,Karmome Shirahama,JAN190700,9781401288785,Color,Softcover
Teen Titans the Silver Age Omnibus HC Vol 01,"(W) Bob Haney & Various (A) Nick Cardy & Various (CA) Darwyn Cooke In these fast-paced tales from the start of the 1960s, the sidekicks to DC's greatest heroes-Robin, Aqualad, Kid Flash, Speedy and Wonder Girl-form their own team to take on evil! Collected for the first time in a single hardcover, these stories pit our teen team against the Demon Dragster, the Mad Mod, Captain Rumble and many other far-out foes. Collects THE BRAVE AND THE BOLD #54, #60 and #83, SHOWCASE #59 and TEEN TITANS #1-19.",57.99,880.0,DC,Bob Haney,Nick Cardy,Darwyn Cooke,JUN160360,9781401267568,Full Color,Hardcover
Teen Titans Raven Beast Boy Box Set HC,Unknown,23.19,,DC,Kami Garcia,Gabriel Picolo,Unknown,JUN207134,9781779507068,Full Color,Hardcover
Teen Titans Go TP Vol 05 Falling Stars,"(W) Sholly Fisch & Various (A) Lea Hernandez & Various (CA) Marcelo DiChiara The Teen Titans are the hippest superhero gang around, and always know the latest trends! So when a new time-wasting gadget is Jump City's latest craze, and no one's getting anything done, the Titans investigate. Can the team pull together to find the gizmo Fun Gus 'Among Us'? Then, the Titans discover a new neighborhood treat when Jump City becomes 'Grounds Zero' for the caffeine craze sweeping the nation! Plus, the Titans finally got their movie and all the fame and glamour that went with it. But are they doomed to wallow after their 15 minutes of fame are over? This all-ages title includes issues #25-30!",7.53,,DC,Sholly Fisch,Lea Hernandez,Marcelo Dichiara,AUG180654,9781401278731,Color,Softcover
Teen Titans Go TP Vol 04 Smells Like Teen Spirit,"(W) Heather Nuhfer & Various (A) Marcelo DiChiara & Various (CA) Dario Brizuela The prank war to end all prank wars has erupted in Titans Tower, but Beast Boy seems to be out-pranking everyone. Then, Robin's 'Poetry Jam' was supposed to be romantic, but things are about to get really gross instead. And when Titans Tower is condemned, the Titans find out if the Batcave is available! Collects TEEN TITANS GO! #19-24.",7.53,128.0,DC,Heather Nuhfer,Marcelo Dichiara,Dario Brizuela,SEP170430,9781401273743,Color,Softcover
Teen Titans Go TP Vol 03 Mumbo Jumble,"(W) Merrill Hagan & Various (A) Lea Hernandez & Various (CA) Dan Hipp In these all-ages tales from issues #13-18, Beast Boy joins Aqualad for the easy life under the sea, Starfire tries to make a fairy godmother show up at the Tower, Cyborg battles the Mallah-ware attacking the Tower's computers, the Amazing Mumbo Jumbo uses his magic to scramble the team's superpowers, and much more!",7.53,128.0,DC,Merrill Hagan,Lea Hernandez,Dan Hipp,OCT160313,9781401267650,Color,Softcover
Teen Titans Go Titans Together TP New Ptg,"The all-ages collection featuring TEEN TITANS GO! #27-32 is back in print, with the team's battles with Jinx, Mas y Menos, Dr. Light and more! Plus, appearances by the Doom Patrol and Nightwing!",7.53,144.0,DC,J. Torres,Todd Nauck Mike Norton,Todd Nauck,JUL140263,9781401253677,Color,Softcover
Teen Titans Go TP Vol 01 Party Party,"(W) Sholly Fisch & Various (A) Ben Bates & Various (CA) Dan Hipp Join Robin, Starfire, Beast Boy, Cyborg and Raven as they display their unique brand of hijinks, mayhem and justice in these stories from issues #1-6 of their new series! But giant pizza monsters aren't the only dastardly and delicious villains on the menu...so dig in, Titans!",7.53,128.0,DC,Sholly Fisch,Ben Bates,Dan Hipp,DEC140400,9781401252427,Full Color,Softcover
Teen Titans Go to Camp TP,"Summer's in the air, and the Teen Titans are leaving Jump City behind for six funfilled weeks of mosquitoes, sunstroke, and poison ivy at summer camp! What the Titans don't realize until they arrive is that this is Camp Apokolips, where the 'bug juice' is made with real bugs, the swimming pool is a fire pit, and the lunch lady is Granny Goodness! Things only get worse when they encounter the bunks they'll be competing against in the camp's games: the Titans East and the H.I.V.E. Five! Given all of that, there's only one thing on Robin's mind... No, not escape. It's how to beat the other bunks to become the camp champions. This is Robin, remember?",5.79,152.0,DC,Unknown,Unknown,Unknown,APR200548,9781779503176,Full Color,Softcover
Teen Titans Go Roll with It TP,"(W) HEATHER NUHFER and P.C. MORRISSEY (A) AGNES GARBOWSKA and SANDY JARRELL (CA) AGNES GARBOWSKA Heather Nuhfer and P.C. Morrissey team up in this fun story about game night with the Titans! The Titans have a regular game of Basements and Basilisks, but when the basement boss (Robin, of course) tries to make the game super fun by making it super-impossible to win, the team rebels. Their new BB is much more fun?and she actually lets them complete their quests, which is excellent motivation to keep playing. But the Boy Wonder begins to worry that the Titans will be trapped in their imaginations forever, going on endless, easy-breezy quests, neglecting their duties in Jump City. There might also be problems with the campaign?s most important relic, the ?Anklet of Extreme Crushing (and Chafing),? which Robin has tightly clasped to his leg.",5.79,,DC,Heather Nuhfer And P.C. Morrissey,Agnes Garbowska And Sandy Jarrell,Agnes Garbowska,JUL207057,9781779504302,Full Color,Softcover
Teen Titans Go Ready for Action TP,"(W) J. Torres (A) Todd Nauck & Various (CA) Todd Nauck, Lary Stucker In this collection based on the hit TV show, it's Teen Titans to the rescue! First, Robin, Cyborg, Starfire, Raven and Beast Boy get their powers scrambled and no one is happy; plus a special holiday issue featuring Billy Numerous! The laughter and fun returns in this volume containing TEEN TITANS GO! #19-25.",7.53,152.0,DC,J. Torres,Todd Nauck,Todd Nauck,FEB170320,9781401268992,Full Color,Soft Cover
Teen Titans Go Bring It On TP New Ed,"(W) J. Torres (A) Todd Nauck, Mike Norton (CA) Todd Nauck The Teen Titans are taking off the training wheels and are ready for action! With no adult supervision they can eat all of the pizza they want and still save the day. But who knew saving the world meant babysitting a werewolf, cleaning up goo, pop quizzes, meditation classes and new theme songs? Find out in these all-ages tales from issues #13-18, now available in DC's standard trim size!",7.53,136.0,DC,J. Torres,Todd Nauck,Todd Nauck,JUL160417,9781401264680,Full Color,Softcover
Transmetropolitan Book Four TP (MR),"(W) Warren Ellis (A) Darick Robertson, Rodney Ramos (CA) Darick Robertson Renegade reporter of the future Spider Jerusalem continues speaking truth to power and exposing corruption, even as the City crumbles around him. After losing his job, his bank account, and his home, Spider has gone underground, the better to implement his plans to expose the evils of the government in the City. Then, all hell breaks loose as a nameless sniper terrorizes the Print District and a raging superstorm clears the streets of the City. Collects Transmetropolitan #37-48, plus the one-shot Transmetropolitan: Filth of the City.",17.39,,DC,Warren Ellis,Rodney Ramos Darick Robertson,Darick Robertson,SEP207109,9781779504692,Full Color,Softcover
Teen Titans Go Box Set,"(W) Sholly Fisch & Various (A) Jorge Corona, Lea Hernandez In these stories from TEEN TITANS GO! #1-24 collected in four trades, the team battles a pizza monster, a sentient video game console, a legion of incompetent super villains, a pair of robotic teeth and more! Also, they help cure Starfire's super gross Tamaranean flu and face off against Teen Titans East in an epic baseball game!",20.29,,DC,Sholly Fisch,Jorge Corona,Unknown,JAN180409,9781401283599,Color,Softcover
Teen Titans Go Box Set Vol 02,"(W) J. Torres & Various (A) Todd Nauck & Various In this four-volume box set, revisit the original Teen Titans Go! tales in Truth, Justice, Pizza! and Heroes on Patrol, alongside the two newest collections, Falling Stars and Weirder Things.",20.29,,DC,J. Torres,Todd Nauck,Unknown,DEC190582,9781779504364,Fc,Softcover
Wonder Woman #750 the Deluxe Edition HC,"The landmark 750th issue of Wonder Woman is collected in a new Deluxe Edition hardcover! Longtime favorites and acclaimed new voices unite to give Diana, Princess of Themyscira, the anniversary volume she deserves. In the lead story, Wonder Woman's epic 'Year of the Villain' battle comes to a close, leading the way to new challenges ahead. Plus, this gem tells tales from Diana's past, present, and future by some of the greatest storytellers in the business-including Colleen Doran, Mariko Tamaki, and Kami Garcia, and legendary creators returning to the character, such as Gail Simone and Greg Rucka! Includes variant covers and more!",10.43,172.0,DC,Unknown,Unknown,Unknown,FEB200583,9781779503978,Full Color,Hardcover
Wonder Woman Book 02 Ares Rising TP,"(W) William Messner-Loebs, Christopher Priest (A) Various (CA) Brian Bolland In these tales from the 1990s, Wonder Woman battles to protect humanity from threats like the reborn god of war, Ares, while helping her allies and friends to find their own paths to peace.Along the way, Wonder Woman collides with Boston mobsters and enlists the help of Superman to discover what calamity has befallen her home of Themyscira!Collects Wonder Woman #77-89 and DC Retroactive: Wonder Woman ?90s #1.",17.39,,DC,Christopher Priest William Messner-Loebs,Various,Brian Bolland,OCT207163,9781779507488,Full Color,Softcover
Wonder Twins TP Vol 02 Fall & Rise of the Wonder Twins,"In these tales from Wonder Twins #7-12, the Wonder Twins are heroes, and the world is saved! Or is it? As Jayna learns how to deal with loss, will Zan finally gain the popular social status he craves? As Jayna's friend-turned-fugitive Polly Math arrives and opens up about her family's painful past on Exxor, they're soon interrupted when Batman and Superman call on Zan and Jayna for an all-star team-up against a rogue army! Jayna must balance their duties to the Justice League with her responsibilities as a friend...each of which is proving quite detrimental to the other! ON SALE 08.05.20",9.85,152.0,DC,Unknown,Unknown,Unknown,JUN200555,9781779501790,Full Color,Softcover
