title,description,price,pagecount,publisher,writer,artist,coverartist,productcode,upc,color,format
Challengers of the Unknown By Jack Kirby TP,"At last, DC collects Jack Kirby's run of adventure epics from SHOWCASE #6, 7, 11 and 12 and CHALLENGERS OF THE UNKNOWN #1-8 in a single paperback volume! These are the tales that introduced Ace Morgan, Red Ryan, Rocky Davis and Professor Haley-four men living on borrowed time, determined to face-and overcome-adversity in the form of monsters, aliens and would-be world conquerors!",17.39,320.0,DC,Unknown,Unknown,Unknown,AUG170333,9781401277192,Color,Softcover
Catwoman 80th Anniv 100 Page Super Spect #1 1990S Gabrielle,(W) Ed Brubaker & Various (A) Cameron Stewart & Various (CA) Frank Cho,6.99,96.0,DC,Unknown,Unknown,Unknown,FEB200408,76194136772900171,Full Color,Softcover
Catwoman Vol 4 Come Home Alley Cat TP,"(W) Various (A) Various (CA) Joelle Jones In the aftermath of ?The Joker War,? Selina Kyle has taken up residence in Alleytown. But when she finds that her old stomping grounds have been taken over by drug-running mobsters, she hatches a plan to take the town back! But unbeknownst to her, she?s being tracked by a terrifying new foe: a hit man in priest?s clothing known only as Father Valley, who carries a bag of bibles around as trophies from each of his victims. Will she be able to loosen the mafia?s stranglehold on her new hometown or become another victim to Father Valley?s sacred oath? Plus, Selina heads to the jungle to steal a diamond from a supervillain auction! Collects Catwoman #14-15 and #22-28.",11.59,,DC,Various,Various,Joelle Jones,NOV207085,9781779504517,Full Color,Softcover
Catwoman TP Vol 03 Friend or Foe (Res),"(W) Joëlle Jones, Fernando Blanco (A) Joëlle Jones & Various (CA) Joëlle Jones Eisner Award-nominated writer/artist Joëlle Jones continues her landmark series as Selina Kyle reconnects with her criminal roots! Lex Luthor's 'Year of the Villain' gift to Catwoman is revealed, and while she wants to remain on the side of good, some habits are too hard to break, and some treasures too tempting. Selina finally has the key to everything Raina Creel wants-and Catwoman is going to get it first. Which all sounds dandy in theory, but Creel has come too far and put up with too much humiliation from Catwoman to let her win again. Will Catwoman come out the other side as a hero...or villain? Collects Catwoman #16-21.",9.85,152.0,DC,Joëlle Jones,Joëlle Jones,Joëlle Jones,MAR200626,9781401299767,Full Color,Softcover
Catwoman 80th Anniv 100 Page Super Spect #1 2000S Jim Lee Va,(W) Ed Brubaker & Various (A) Cameron Stewart & Various (CA) Frank Cho,6.99,96.0,DC,Unknown,Unknown,Unknown,FEB200409,76194136772900181,Full Color,Softcover
Catwoman 80th Anniv 100 Page Super Spect #1 1980S Stanley La,(W) Ed Brubaker & Various (A) Cameron Stewart & Various (CA) Frank Cho,6.99,96.0,DC,Unknown,Unknown,Unknown,FEB200407,76194136772900161,Full Color,Softcover
Catwoman 80th Anniv 100 Page Super Spect #1,(W) Ed Brubaker & Various (A) Cameron Stewart & Various (CA) Frank Cho,6.99,96.0,DC,Unknown,Unknown,Unknown,FEB200402,76194136772900111,Full Color,Softcover
DC Poster Portfolio Francesco Mattina TP,"(A/CA) Francesco Mattina DC spotlights top cover artists with the Poster Portfolio series, featuring Francesco Mattina! This collection includes 20 of Francesco Mattina's most striking covers from across the DC Universe, including Batman, Dark Nights: Metal, and more! Printed on heavy card stock paper at a big 12 by 16 inches, the pages of the Poster Portfolio are easily pulled out and are suitable for framing.",14.49,,DC,Unknown,Unknown,Unknown,MAR200635,9781779505064,Full Color,Softcover
Catwoman 80th Anniv 100 Page Super Spect #1 1970S Frank Cho,(W) Ed Brubaker & Various (A) Cameron Stewart & Various (CA) Frank Cho,6.99,96.0,DC,Unknown,Unknown,Unknown,FEB200406,76194136772900151,Full Color,Softcover
Catwoman 80th Anniv 100 Page Super Spect #1 1950S Travis Cha,(W) Ed Brubaker & Various (A) Cameron Stewart & Various (CA) Frank Cho,6.99,96.0,DC,Unknown,Unknown,Unknown,FEB200404,76194136772900131,Full Color,Softcover
DC Comics Book and DVD Blu Ray Slipcase Set,"All six book-and-animated movie sets are also available in this amazing slipcase set! Each includes a hardcover book plus the animated movie inspired by the book in both Blu-Ray and DVD formats on two discs! This set includes: BATMAN BLACK AND WHITE, THE DEATH OF SUPERMAN, BATMAN YEAR ONE, JUSTICE LEAGUE ORIGIN, JLA EARTH 2, WONDER WOMAN: GODS AND MORTALS",91.13,,DC,Unknown,Unknown,Unknown,MAR158511,9781401260071,Color,Hardcover
Catwoman 80th Anniv 100 Page Super Spect #1 1940S Adam Hughe,(W) Ed Brubaker & Various (A) Cameron Stewart & Various (CA) Frank Cho,6.99,96.0,DC,Unknown,Unknown,Unknown,FEB200403,76194136772900121,Full Color,Softcover
DC Super Hero Girls TP Vol 02 Hits and Myths,"(W) Shea Fontana (A/CA) Yancy Labat 'Intro to Epics' is one of Wonder Woman's favorite classes at DC Super Hero High, but even for an overachiever, balancing high school literature assignments with learning to be a superhero can be tough. But you know what they say about learning-experience is the best teacher! So when Wonder Woman, Batgirl, Supergirl, Bumblebee, Poison Ivy, Katana, and Harley Quinn fight a cyclops, a witch, and a bevy of sirens, they're sure to learn a thing or two about The Odyssey-if they survive their epic battle in the underworld!",5.79,128.0,DC,Shea Fontana,Yancy Labat,Yancy Labat,AUG160270,9781401267612,Full Color,Softcover
Deadman Kelley Jones Gallery Edition HC,"(W) Mike Baron (A/CA) Kelley Jones The unmistakable art of Kelley Jones sets the mood for two gothic thrillers in the new DEADMAN: KELLEY JONES GALLERY EDITION. Collecting Jones' artwork from DEADMAN: LOVE AFTER DEATH #1-2 and DEADMAN: EXORCISM #1-2, this Smythe-sewn hardcover edition is sourced from the original boards and showcases the boldly dramatic line art that established Jones' creative style prior to his work on Batman and other DC characters. Both tales were written by Mike Baron and first published in 1989 and 1992. Graphitti Designs' Gallery Editions replicate the look, feel and attitude of the original artwork. Every page is reproduced at full board size on heavy paper stock to provide fans and collectors with museum-quality reproductions that are unobtainable from any other source. Aerialist Boston Brand comes to (after)life as never before in these graceful, moody pages. Experience the glory of Kelley Jones' legendary DEADMAN artwork here in all its haunting beauty!",100.0,228.0,DC,Mike Baron,Kelley Jones,Kelley Jones,SEP160334,9781401272500,Black & White,Hardcover
DC Poster Portfolio DCeased TP,"(A) Greg Capullo & Various (CA) Francesco Mattina DC spotlights the hit DCeased event with the Poster Portfolio series! This collection includes 20 of the terrifyingly visceral covers from the hit miniseries, showcasing a horrifying vision of DC's greatest characters infected by the Anti-Life Equation! Printed on heavy card stock paper at a big 12 by 16 inches, the pages of the Poster Portfolio are easily pulled out and are suitable for framing.",14.49,,DC,Unknown,Unknown,Unknown,MAR200636,9781779506566,Full Color,Softcover
Deadman By Kelley Jones Complete Coll TP,"(W) Mike Baron (A) Kelley Jones & Various (CA) Kelley Jones Deadman has gone from supernatural hero to insane spirit of evil, and with a tide of demons threatening humanity, his true power can only be unlocked if he faces the secret within him that has driven him mad. Collects DEADMAN: LOVE AFTER DEATH #1-2 and DEADMAN: EXORCISM #1-2, plus stories from ACTION COMICS WEEKLY #618-621 and 623-626.",14.49,272.0,DC,Mike Baron,Kelley Jones,Kelley Jones,MAY170336,9781401271671,Full Color,Softcover
Dcs Wanted Worlds Most Dangerous Supervillains HC,"Take a journey into the dark minds of DC's most dangerous super-villains in these tales starring The Joker, the Mist, Captain Cold, Signalman, the Puppeteer, Clock King, Mr. Who and many more. Collects WANTED: THE WORLD'S MOST DANGEROUS VILLAINS #1-9 from 1972, which reprinted stories from ACTION COMICS #57 and 69; BATMAN #25, 84 and 112; WORLD'S FINEST COMICS #6 and 111; THE FLASH #114 and 121; ADVENTURE COMICS #72 and 77; GREEN LANTERN #1 and 33; WONDER WOMAN #36; SENSATION COMICS #66 and 71; MORE FUN COMICS #65, 73 and 76; FLASH COMICS #86, 90 and 100; ALL-AMERICAN COMICS #61; KID ETERNITY #15; and DOLL MAN QUARTERLY #15.",23.19,256.0,DC,Bill Finger,Sheldon Moldoff,Nick Cardy,AUG190654,9781779501738,Color,Hardcover
Dcs Greatest Detective Stories Ever Told TP,"(W) Various (A) Various (CA) Michael William Kaluta Batman may be the World?s Greatest Detective, but he?s hardly the only sleuth in the DC Universe. This new title collects key adventures starring Lois Lane, the Question, the Sandman (Wesley Dodds), Detective Chimp, Slam Bradley, and of course, the Dark Knight Detective. These tales span DC?s history, from 1937 to today, and even include a special appearance by the granddaddy of all detectives: Sherlock Holmes.<p>Collects stories from Adventure Comics #51, Batman #441, Detective Comics #2, #329, and #572, Lois Lane #1-2, Secret Origins #40, and The Question #8.",11.59,,DC,Various,Various,Michael William Kaluta,OCT207136,9781779505941,Full Color,Softcover
Dceased Unkillables HC,"When heroes fall, villains rise! The next chapter of the hit DCeased saga is the villains' story of survival during the zombie apocalypse! Led by Red Hood and Deathstroke, DC's hardest villains and antiheroes fight with no mercy to save the only commodity left on a dying planet of the undead - life! Heroes and villains collide with one epic purpose: to escape the coming of the infected population of Gotham City and a monstrous Wonder Woman! Collects DCeased: Unkillables #1-3.",14.49,,DC,Unknown,Unknown,Unknown,APR200663,9781779503930,Full Color,Hardcover
Deadman Omnibus HC,"(W) Various (A) Various (CA) Neal Adams Originally introduced in 1967, Deadman was a circus performer known as Boston Brand who was murdered while on the high wire. In the afterlife, a mysterious being known as Rama Kushna gifted his spirit with the ability to possess the bodies of the living, so he could discover the identity of his killer and bring THEM to justice! Featuring spectacular art by Neal Adams, Jos? Luis Garc?a-L?pez, and others, these tales take Deadman across the DC Universe in search of justice. This massive hardcover collects Strange Adventures #205-216; The Brave and the Bold #79, #86, #104, and #133; Aquaman #50-52; Challengers of the Unknown #74 and #84-87; Justice League of America #94; World?s Finest Comics #223 and #227; The Phantom Stranger #33 and #39-41; Superman Family #183; DC Super-Stars #18; DC Special Series #8; Adventure Comics #459-466; DC Comics Presents #94; Detective Comics #500; Deadman #1-4 (1986); and Secret Origins #15.",57.99,,DC,Various,Various,Neal Adams,AUG207128,9781779504883,Full Color,Hardcover
DC Universe By Mike Mignola HC,"This new title collects Mike Mignola's work on comics including SUPERMAN: THE WORLD OF KRYPTON #1-4, ACTION COMICS ANNUAL #2, SUPERMAN #18 and 23, BATMAN: LEGENDS OF THE DARK KNIGHT #54, BATMAN: GOTHAM KNIGHTS #36, SWAMP THING ANNUAL #5, PHANTOM STRANGER #1-4 and more! Also collects dozens of covers by Mignola!",23.19,400.0,DC,Neil Gaiman,Mike Mignola,Mike Mignola,FEB170306,9781401268886,Full Color,Hard Cover
Dear DC Super-Villains TP,"(W) Michael Northrop (A/CA) Gustavo Duarte Peek inside the lives of DC?s infamous rogues in Dear DC Super-Villains, the sequel to Dear Justice League, in which curious kids write to notorious scoundrels, asking them about life on the dark side. How did Gorilla Grodd get so smart? Did Harley Quinn ever try a career in comedy? Why does Catwoman always lose to Batman? Each chapter highlights members of the Legion of Doom in a sympathetic way that is relatable to kids. But look closely and you may notice the baddies are up to something big! Will the Justice League show up in time to stop them? You?ll have to write in to the tip line of evil to find out!",5.79,,DC,Michael Northrop,Gustavo Duarte,Gustavo Duarte,DEC207061,9781779500540,Full Color,Softcover
Dceased TP,"(W) Tom Taylor (A) Various (CA) Francesco Mattina The horror hit that launched a franchise is now in softcover! What happens to the World?s Finest if the world ends? With death spreading across the planet, who will live and who will turn in this apocalyptic tale of heroism, sacrifice, and annihilation? Fighting time, each other, and all of humanity, Earth?s greatest heroes must rally together for what may very well be their last chance to save the world from the most terrible plague humanity has ever seen. The Anti-Life Equation has been released and is ravaging the world at the viral speed of social media. Once exposed, victims lose their minds, violently attacking all around them. The heroes of Earth are fighting a losing battle to save the world...and themselves! Collects DCeased #1-6 and DCeased: A Good Day to Die #1.",11.59,,DC,Tom Taylor,Various,Francesco Mattina,DEC207096,9781779505651,Full Color,Softcover
DC Universe By Neil Gaiman TP,"(W) Neil Gaiman (A) Andy Kubert & Various (CA) Andy Kubert New York Times best-selling author Neil Gaiman's tales of DC's greatest superheroes are collected in a new trade paperback. Gaiman, co-creator of THE SANDMAN and author of American Gods, teams with superstar artist Andy Kubert to tell the story that truly defines the years of Batman's life in the epic 'Whatever Happened to the Caped Crusader?' Also included are stories starring Batman, Poison Ivy, The Riddler, Metamorpho and others from the pages of SECRET ORIGINS #36, SECRET ORIGINS SPECIAL #1, WEDNESDAY COMICS #1-12, BATMAN #686, DETECTIVE COMICS #853 and GREEN LANTERN/SUPERMAN: LEGEND OF THE GREEN FLAME #1.",11.59,,DC,Neil Gaiman,Andy Kubert,Andy Kubert,NOV170366,9781401277734,Color,Softcover
DC Through the 80S the End of Eras HC,"(W) Various (A) Various (CA) Curt Swan, Murphy Anderson The ?80?s were a truly rad time for comic books. DC was killing it with groundbreaking titles like Man of Steel, Batman: The Dark Knight Returns, and Watchmen. This collection, curated by writer and former DC publisher Paul Levitz, celebrates the pre-Crisis on Infinite Earths era of the early 1980s with memorable adventures including Alan Moore and Curt Swan?s poignant ?Whatever Happened to the Man of Tomorrow?,? both Batman and Superman teaming with their Golden Age equivalents in separate stories, Wonder Woman and Steve Trevor versus gremlins, and more. Collects Action Comics #583, Detective Comics #500, The Flash #296-298, Jonah Hex #54-55, Superman #423, House of Mystery #286, #290, #294-295, #300, #308, #321, Warlord #42, Wonder Woman #311-312, The Brave and the Bold #200, Weird War Tales #93, Time Warp #2 and #3, G.I. Combat #288, Blackhawk #258, DC Comics Presents Annual #1, Super Friends #36, and Sgt. Rock #345, #347, #368, and #387. Also includes new essays on this amazing era from such comics luminaries as Jack C. H",28.99,,DC,Various,Various,Murphy Anderson Curt Swan,SEP207100,9781779500878,Full Color,Hardcover
DC Young Animal Milk Wars TP (MR),"(W) Steve Orlando & Various (A) Aco & Various (CA) Frank Quitely What happens when the Doom Patrol meets the Justice League of America? Working together, can they destroy the evil, interdimensional corporation called RetConn? To kick off its plan to use the radioactive milk of psychic cows to take the edge off the World's Greatest Heroes, RetConn has gone all the way to the top. Meet Milkman Man, previously unknown son of Krypton, who was sent to our planet only to be adopted by an evil dairy farmer and raised to love all things dairy! Collects JLA/DOOM PATROL SPECIAL #1, MOTHER PANIC / BATMAN SPECIAL #1, SHADE, THE CHANGING GIRL / WONDER WOMAN SPECIAL #1, CAVE CARSON HAS A CYBERNETIC EYE / SWAMP THING SPECIAL #1 and DOOM PATROL / JLA SPECIAL #1.",11.59,,DC,Steve Orlando,Aco,Frank Quitely,MAR180321,9781401277338,Color,Softcover
DC Superhero Girls Spaced Out TP,"(W) Shea Fontana (A) Agnes Garbowska (CA) Yancy Labat Earth's new Green Lantern, Jessica Cruz, learns that she must report to Oa and introduce herself to the Green Lantern Corps--as if learning new powers and being the new girl at Super Hero High weren't enough! Luckily, some of her new friends are willing to accompany Jessica. But when they arrive, instead of the Green Lantern Corps they find General Zod, Faora and Non. While the spacefaring girls take on this intergalactic threat, the Earthbound students are faced with their own challenge--pet-sitting Krypto! It's Kryptonian chaos across the universe!",5.79,128.0,DC,Shea Fontana,Agnes Garbowska,Yancy Labat,JAN190555,9781401282561,Color,Softcover
DC Super Hero Girls Search for Atlantis TP,"(W) Shea Fontana (A/CA) Yancy Labat Mera is the new girl at Super Hero High, and when Wonder Woman takes Mera under her wing, Wonder Woman's best friend Bumblebee is overcome with jealousy. Despite her feelings, Bumblebee accompanies Mera and the Super Hero Girls on a field trip to Atlantis. But when they arrive, Atlantis is missing! Mera is horrified when they discover that Brainiac has shrunken and stolen Atlantis with the Atlanteans trapped inside! The Super Hero Girls must work together to defeat Brainaic and, along the way, Bumblebee must learn the true meaning of friendship.",5.79,,DC,Shea Fontana,Yancy Labat,Yancy Labat,JUN180439,9781401283537,Color,Softcover
DC Super Hero Girls Date with Disaster TP,"(W) Shea Fontana (A/CA) Yancy Labat From the highly successful DC SUPER HERO GIRLS line of original graphic novels comes the latest title, starring Batgirl! Catwoman is out on the prowl one night when kaboom! An explosion at S.T.A.R. Labs rouses the heroes from their slumber. Star students Batgirl and Lois Lane both know the lab incident is fishy, and they meet later to share clues. But nothing could've prepared Batgirl for what they see next: Batgirl's dad out on a date! Batgirl is grossed out until her friends convince her that dads get lonely, too. And with the school dance coming up and everyone pairing off-heck, even Principal Waller has a date with a guy called Deadshot-maybe it'll be okay. The girls place a personal ad for Commissioner Gordon while they delve deeper into the mystery surrounding the explosion, but they're about to discover more than who is behind the attack on S.T.A.R. Labs. Could it be that posting an ad looking for dates for the commissioner is like advertising catnip for criminals?",5.79,128.0,DC,Shea Fontana,Yancy Labat,Yancy Labat,NOV170216,9781401278786,Color,Softcover
DC Super Hero Girls Out of the Bottle TP,"(W) Shea Fontana (A) Marcelo DiChiara & Various (CA) Yancy Labat Harley Quinn takes center stage in the new volume of the DC Super Hero Girls graphic novel series, DC SUPER HERO GIRLS: OUT OF THE BOTTLE! For an assignment in Ms. June Moone's art class, the girls are working on their very own comic books. The character-created comics pages give us a glimpse into each girl's personality. But Harley isn't satisfied with her comics creation and thinks a little of Ms. Moone's special paint will really help her drawings come to life! The problem? Harley's drawings literally come to life!",5.79,128.0,DC,Shea Fontana,Marcelo Dichiara,Yancy Labat,FEB180156,9781401274832,Color,Softcover
DC Super Hero Girls TP Vol 01 Finals Crisis,"Preparing for high school exams is hard enough, but at Super Hero High, even the tests are super-tough! Principal Waller keeps an eagle eye on her students, drilling them in math, science, literature-and other subjects like flying and powers! And no one wants to fail, because Principal Waller hands out detention faster than a speeding bullet. In the first-ever all ages DC Super Hero Girls original graphic novel, Supergirl, Wonder Woman, Bumblebee, Batgirl, Harley Quinn, Katana, and Poison Ivy are studying hard-well, maybe not Harley Quinn- when they are each abducted by a mysterious villain! Will the students outsmart their captor, save Gotham City, and still pass their finals?",5.79,128.0,DC,Unknown,Unknown,Unknown,APR160322,9781401262471,Full Color,Softcover
DC Super Hero Girls at Metropolis High TP,"A new era begins for the DC Super Hero Girls in DC Super Hero Girls At Metropolis High! When Batgirl, Wonder Woman, Supergirl, Green Lantern, Bumblebee, and Zatanna are continually late to class because of their crime-fighting, they are sentenced to joining an after-school club for a whole week-or else they'll be suspended! But finding a club is not as easy as it looks, and when the girls keep finding themselves kicked out of the clubs they like, they must think outside of the box and go outside their comfort zones to avoid suspension. Just when they thought secret identities and balancing school with super-heroics were challenging enough!",5.79,152.0,DC,Amy Wolfram,Yancy Labat,Yancy Labat,JUL190526,9781401289706,Color,Softcover
DC Poster Portfolio Year of the Villain TP,"The latest DC POSTER PORTFOLIO focuses on the evildoers of 'Year of the Villain' as seen in this special event, with art by Stanley 'Artgerm' Lau, Gabriel Dell'Otto, Frank Quitely, Alex Maleev and more! Printed on heavy cardstock paper at a big 12 inches by 16 inches, the pages of the DC POSTER PORTFOLIOS are easily removed from the binding and are suitable for framing.",14.49,42.0,DC,Unknown,Unknown,Unknown,AUG190651,9781779500960,Color,Softcover
DC Poster Portfolio Jim Lee TP,"(A/CA) Jim Lee, Scott Williams DC spotlights top cover artists with the new POSTER PORTFOLIO series, starting with superstar illustrator Jim Lee! This collection includes 20 of Jim Lee's most memorable DC covers starring Batman, Wonder Woman, Superman, the Justice League of America and more! Printed on heavy cardstock paper at a big 12 by 16 inches, the pages of the POSTER PORTFOLIOS are easily pulled out and are suitable for framing.",14.49,42.0,DC,Unknown,Jim Lee,Jim Lee,JAN190671,9781401294250,Color,Softcover
DC Poster Portfolio Stanley Artgerm Lau TP Vol 02,"DC spotlights top cover artists with the Poster Portfolio series, continuing with a second helping of frame-worthy artwork by Stanley 'Artgerm' Lau! This collection includes 20 of his most memorable DC covers, highlighted by Wonder Woman, Catwoman, Supergirl, and many more! Printed on heavy card stock at a big 12 by 16 inches, the pages of the Poster Portfolios are easily pulled out and are suitable for framing.",14.49,42.0,DC,Unknown,Unknown,Unknown,JAN200643,9781779502780,Full Color,Softcover
DC Poster Portfolio James Jean TP,"DC spotlights top cover artists with the new Poster Portfolio series, continuing with celebrated artist James Jean! This collection includes 20 of Jean's most memorable DC covers, highlighted by his years of iconic work on Fables! Printed on heavy card stock paper at a big 12 inches by 16 inches, the pages of the Poster Portfolio are easily removed from the binding and are suitable for framing.",14.49,42.0,DC,Unknown,Unknown,Unknown,FEB200551,9781779504937,Full Color,Softcover
DC Poster Portfolio Stanley Artgerm Lau TP,"(A/CA) Stanley Lau DC spotlights top cover artists with the new POSTER PORTFOLIO series, starting with superstar illustrator Stanley 'Artgerm' Lau! This collection includes 20 of Artgerm's most memorable DC covers starring Supergirl, Catwoman, Batman, Wonder Woman and more! Printed on heavy cardstock paper at a big 12 by 16 inches, the pages of the POSTER PORTFOLIOS are easily pulled out and are suitable for framing. Watch for upcoming POSTER PORTFOLIOS featuring the art of Jim Lee, Frank Cho and more!",14.49,42.0,DC,Unknown,Stanley Lau,Stanley Lau,OCT180551,9781401293451,Color,Softcover
DC Poster Portfolio Greg Capullo TP,"(A/CA) GREG CAPULLO DC spotlights top cover artists with the new Poster Portfolio series, continuing with era-defining superstar Greg Capullo! This collection includes 20 of Capullo?s most memorable DC images, highlighted by his years on Batman and his DC Universe-rocking events Dark Nights: Metal and Dark Nights: Death Metal! Printed on heavy card stock paper at a big 12 inches by 16 inches, the pages of the Poster Portfolio are easily removed from the binding and are suitable for framing.",14.49,,DC,Unknown,Greg Capullo,Greg Capullo,JUL207119,9781779508034,Full Color,Softcover
DC Poster Portfolio Frank Cho TP,"DC spotlights top cover artists with the new POSTER PORTFOLIO series, continuing with acclaimed illustrator Frank Cho! This collection includes 20 of Cho's most memorable DC covers starring Harley Quinn, Wonder Woman and more! Printed on heavy cardstock paper at a big 12 inches by 16 inches, the pages of the POSTER PORTFOLIOS are easily removed from the binding and are suitable for framing.",14.49,,DC,Unknown,Frank Cho,Frank Cho,MAR190575,9781401294908,Color,Softcover
DC Holiday Knightmares TP,"The holidays are just around the corner-and what better way to celebrate than with the heroes (and villains!) of the DC Universe! This new stocking stuffer collects DC'S NUCLEAR WINTER SPECIAL #1, HARLEY QUINN #55 and a story from SWAMP THING WINTER SPECIAL #1.",9.85,144.0,DC,Tom King,Jason Fabok,Yanick Paquette,AUG190655,9781401294878,Color,Softcover
